アルマダ・バトルスフィア待機場所,Armada Battlesphere Waiting Area template,stage/ln_area_template_3221.ice,fe82020b80bf790326faf74c8b5eb79f
アルマダ・バトルスフィア内部,Armada Battlesphere Interior template,stage/ln_area_template_3230.ice,09f4429649c530bf6414bbb81ba65cf4
破滅の艦隊 セクター3（首都圏侵攻作戦）,Armada of Demise Sector 3 (Capital Ship Invasion) template,stage/ln_area_template_3240.ice,949d8dcc4b96ebea2b078932ccc2a11e
虚無より睨む原初の闇 (エリア１),Primordial Darkness (Area 1) template,stage/ln_area_template_3250.ice,ebd8f09060f4e443fa03b77ae95c9390
虚無より睨む原初の闇 (エリア２),Primordial Darkness (Area 2) template,stage/ln_area_template_3251.ice,efce425d2c708a5be36c978ae332baea
マザーシップ コア(シバ),Mothership Core (Shiva) template,stage/ln_area_template_3260.ice,bc03839efb1cabdcf2d5609ea4d17184
アークスシップ司令部, Arks Ship Command Center template,stage/ln_area_template_3290.ice,3fd5162788324379b26773ba7108fdf7
A.I.S.開発室,A.I.S. Development Room template,stage/ln_area_template_3291.ice,bab78e7187a5ee6142be20f7d0952765
_,_ template,stage/ln_area_template_9000.ice,17529fbbdd6f769b2446633da709a3d6
